{
  "$schema": "http://json-schema.org/draft-07/schema#",
  "$id": "pack-schema.json",
  "title": "MarkOS Pack Manifest",
  "description": "Schema for lib/markos/packs/*.pack.json manifest files. Validated by Ajv v8 with strict:false.",
  "type": "object",
  "required": [
    "slug",
    "version",
    "displayName",
    "type",
    "aliases",
    "disciplines",
    "completeness",
    "assets",
    "fallbackAllowed",
    "changelog"
  ],
  "additionalProperties": false,
  "properties": {
    "slug": {
      "type": "string",
      "minLength": 1,
      "pattern": "^[a-z0-9]([a-z0-9-]*[a-z0-9])?$",
      "description": "Canonical identifier. Lowercase alphanumeric and internal hyphens only. Used as map key and file name prefix. Pattern prevents path traversal."
    },
    "version": {
      "type": "string",
      "pattern": "^\\d+\\.\\d+\\.\\d+$",
      "description": "Semantic version string (MAJOR.MINOR.PATCH)"
    },
    "displayName": {
      "type": "string",
      "minLength": 1,
      "description": "Human-readable name shown in the operator override UI"
    },
    "type": {
      "type": "string",
      "enum": ["base", "overlay"],
      "description": "base = business-model family pack; overlay = industry overlay pack (Phase 108+)"
    },
    "aliases": {
      "type": "array",
      "items": { "type": "string", "minLength": 1 },
      "minItems": 1,
      "description": "All alias strings that resolve to this pack via normalizeBusinessModel()"
    },
    "industries": {
      "type": "array",
      "items": { "type": "string" },
      "description": "Industry slugs this pack is broadly relevant to (empty for generic base packs)"
    },
    "disciplines": {
      "type": "array",
      "items": {
        "type": "string",
        "enum": ["Paid_Media", "Content_SEO", "Lifecycle_Email", "Social", "Landing_Pages"]
      },
      "minItems": 1,
      "description": "Disciplines covered by this pack"
    },
    "completeness": {
      "type": "object",
      "additionalProperties": {
        "type": "string",
        "enum": ["full", "partial", "stub", "missing"]
      },
      "description": "Per-discipline completeness. Values: full=production-ready; partial=some assets exist; stub=placeholder only; missing=not started"
    },
    "assets": {
      "type": "object",
      "required": ["baseDoc", "proofDoc"],
      "additionalProperties": false,
      "properties": {
        "baseDoc": {
          "type": "string",
          "minLength": 1,
          "description": "Relative repo path to the tone+naturality literacy document for this pack"
        },
        "proofDoc": {
          "type": "string",
          "minLength": 1,
          "description": "Relative repo path to the proof-posture literacy document for this pack"
        },
        "overlayDoc": {
          "type": ["string", "null"],
          "description": "Relative repo path to the business-model-level overlay document, or null if none"
        },
        "skeletonDir": {
          "type": ["string", "null"],
          "description": "Relative repo path to the skeleton template directory for this pack, or null if none yet"
        }
      }
    },
    "fallbackAllowed": {
      "type": "boolean",
      "description": "Whether the system may fall back to this pack when a more specific one is unavailable"
    },
    "overlayFor": {
      "description": "For overlay packs: array of base pack slugs this overlay applies to. null for base packs.",
      "oneOf": [
        { "type": "null" },
        { "type": "array", "items": { "type": "string" } }
      ]
    },
    "dependencies": {
      "type": "array",
      "items": { "type": "string" },
      "description": "Slugs of other packs that must be loaded before this one"
    },
    "operatorNotes": {
      "type": "string",
      "description": "Human-readable notes displayed in the operator override approval step"
    },
    "changelog": {
      "type": "array",
      "minItems": 1,
      "items": {
        "type": "object",
        "required": ["version", "date", "summary"],
        "additionalProperties": false,
        "properties": {
          "version": { "type": "string", "pattern": "^\\d+\\.\\d+\\.\\d+$" },
          "date":    { "type": "string", "pattern": "^\\d{4}-\\d{2}-\\d{2}$" },
          "summary": { "type": "string", "minLength": 1 }
        }
      },
      "description": "Schema version history. At least one entry required."
    }
  }
}
