{
  "slug": "ecommerce",
  "version": "1.1.0",
  "displayName": "Ecommerce (DTC, Marketplace, Retail)",
  "type": "base",
  "aliases": [
    "ecommerce",
    "e-commerce",
    "dtc",
    "marketplace",
    "retail"
  ],
  "industries": [],
  "disciplines": [
    "Paid_Media",
    "Content_SEO",
    "Lifecycle_Email",
    "Social",
    "Landing_Pages"
  ],
  "completeness": {
    "Paid_Media": "partial",
    "Content_SEO": "partial",
    "Lifecycle_Email": "partial",
    "Social": "partial",
    "Landing_Pages": "partial"
  },
  "assets": {
    "baseDoc": ".agent/markos/literacy/Shared/TPL-SHARED-business-model-ecommerce.md",
    "proofDoc": ".agent/markos/literacy/Shared/TPL-SHARED-proof-posture.md",
    "overlayDoc": ".agent/markos/literacy/Shared/TPL-SHARED-overlay-ecommerce.md",
    "skeletonDir": "onboarding/templates/SKELETONS/ecommerce/"
  },
  "fallbackAllowed": true,
  "overlayFor": null,
  "dependencies": [],
  "operatorNotes": "",
  "changelog": [
    {
      "version": "1.0.0",
      "date": "2026-04-14",
      "summary": "Initial pack definition migrated from FAMILY_REGISTRY"
    },
    {
      "version": "1.1.0",
      "date": "2026-04-15",
      "summary": "Phase 107: authored per-family tone doc, 5-discipline skeletons; graduated completeness stub→partial"
    }
  ]
}
