{
  "slug": "b2b",
  "version": "1.2.0",
  "displayName": "B2B (Business-to-Business)",
  "type": "base",
  "aliases": [
    "b2b",
    "business to business",
    "enterprise"
  ],
  "industries": [],
  "disciplines": [
    "Paid_Media",
    "Content_SEO",
    "Lifecycle_Email",
    "Social",
    "Landing_Pages"
  ],
  "completeness": {
    "Paid_Media": "full",
    "Content_SEO": "full",
    "Lifecycle_Email": "full",
    "Social": "full",
    "Landing_Pages": "full"
  },
  "assets": {
    "baseDoc": ".agent/markos/literacy/Shared/TPL-SHARED-business-model-b2b.md",
    "proofDoc": ".agent/markos/literacy/Shared/TPL-SHARED-proof-posture.md",
    "overlayDoc": null,
    "skeletonDir": "onboarding/templates/SKELETONS/b2b/"
  },
  "fallbackAllowed": true,
  "overlayFor": null,
  "dependencies": [],
  "operatorNotes": "",
  "changelog": [
    {
      "version": "1.0.0",
      "date": "2026-04-14",
      "summary": "Initial pack definition migrated from FAMILY_REGISTRY"
    },
    {
      "version": "1.1.0",
      "date": "2026-04-15",
      "summary": "Phase 107: authored per-family tone doc, 5-discipline skeletons; graduated completeness stub→partial"
    },
    {
      "version": "1.2.0",
      "date": "2026-04-15",
      "summary": "Phase 110: graduated completeness partial→full; all 5 disciplines authored and verified"
    }
  ]
}
