{
  "slug": "b2c",
  "version": "1.1.0",
  "displayName": "B2C (Business-to-Consumer)",
  "type": "base",
  "aliases": [
    "b2c",
    "business to consumer",
    "consumer"
  ],
  "industries": [],
  "disciplines": [
    "Paid_Media",
    "Content_SEO",
    "Lifecycle_Email",
    "Social",
    "Landing_Pages"
  ],
  "completeness": {
    "Paid_Media": "partial",
    "Content_SEO": "partial",
    "Lifecycle_Email": "partial",
    "Social": "partial",
    "Landing_Pages": "partial"
  },
  "assets": {
    "baseDoc": ".agent/markos/literacy/Shared/TPL-SHARED-business-model-b2c.md",
    "proofDoc": ".agent/markos/literacy/Shared/TPL-SHARED-proof-posture.md",
    "overlayDoc": null,
    "skeletonDir": "onboarding/templates/SKELETONS/b2c/"
  },
  "fallbackAllowed": true,
  "overlayFor": null,
  "dependencies": [],
  "operatorNotes": "",
  "changelog": [
    {
      "version": "1.0.0",
      "date": "2026-04-14",
      "summary": "Initial pack definition migrated from FAMILY_REGISTRY"
    },
    {
      "version": "1.1.0",
      "date": "2026-04-15",
      "summary": "Phase 107: authored per-family tone doc, 5-discipline skeletons; graduated completeness stub→partial"
    }
  ]
}
