{
  "slug": "services",
  "version": "1.0.0",
  "displayName": "Professional Services (Consulting & Services)",
  "type": "base",
  "aliases": ["services", "service", "consulting", "consultant", "professional services"],
  "industries": [],
  "disciplines": ["Paid_Media", "Content_SEO", "Lifecycle_Email", "Social", "Landing_Pages"],
  "completeness": {
    "Paid_Media": "stub",
    "Content_SEO": "stub",
    "Lifecycle_Email": "stub",
    "Social": "stub",
    "Landing_Pages": "stub"
  },
  "assets": {
    "baseDoc": ".agent/markos/literacy/Shared/TPL-SHARED-tone-and-naturality.md",
    "proofDoc": ".agent/markos/literacy/Shared/TPL-SHARED-proof-posture.md",
    "overlayDoc": ".agent/markos/literacy/Shared/TPL-SHARED-overlay-consulting.md",
    "skeletonDir": "onboarding/templates/SKELETONS/services/"
  },
  "fallbackAllowed": true,
  "overlayFor": null,
  "dependencies": [],
  "operatorNotes": "",
  "changelog": [
    { "version": "1.0.0", "date": "2026-04-14", "summary": "Initial pack definition migrated from FAMILY_REGISTRY" }
  ]
}
